{
  "schema_version": "1.0.0",
  "envelope_version": 1,
  "artifact_id": "6b8681b3-2181-4ecd-81ac-70f6a7f7b98b",
  "job_id": "00000000-0000-4000-8000-000000000001",
  "parent_artifact_ids": [
    "c8bdd16c-6502-425a-be7a-62028dd35e6d",
    "39b2c1c9-df3d-408f-bf31-a9f6e18c9692",
    "07105436-4f4d-4209-bae0-9b7487eb5a40",
    "766bfa4f-935b-4b15-8855-d9f8464b871e"
  ],
  "artifact_type": "report_export",
  "stage": "export_report",
  "source_skill": "export_report",
  "producer": {
    "kind": "control_plane",
    "name": "export_report",
    "version": "0.1.0"
  },
  "status": "reportable",
  "created_at": "2026-06-04T00:00:00Z",
  "coordinate_frame": {
    "frame_id": "report_display",
    "frame_type": "report_display",
    "crs": "EPSG:32617",
    "origin": null,
    "axis_orientation": "ENU",
    "units": "ft",
    "has_z": true,
    "z_convention": "orthometric_m",
    "transform_to_source": null,
    "transform_to_local": null,
    "transform_to_raster": null,
    "transform_to_export": null,
    "precision": {
      "xy_m": 0.05,
      "z_m": 0.1
    },
    "status": "complete"
  },
  "units": {
    "horizontal_distance": "m",
    "vertical_distance": "m",
    "area": "m^2",
    "slope": "deg",
    "pitch": "rise_per_12",
    "angle": "deg",
    "raster_resolution": "m_per_px",
    "confidence": "ratio_0_1",
    "quality_score": "ratio_0_1"
  },
  "geometry": {
    "geometry_type": "export_document",
    "coordinate_frame": "report_display",
    "dimensions": null,
    "bbox": null,
    "value": null,
    "storage_ref": null,
    "precision": null,
    "no_data_policy": null
  },
  "data": {
    "document_uri": "supabase://measurement-artifacts/00000000-0000-4000-8000-000000000001/exports/measurement_report.pdf",
    "mime_type": "application/pdf",
    "pages": 6,
    "included_artifact_ids": [
      "2ab6f71d-e129-405e-a33d-9ab9627ad826",
      "d3007ffc-4cf0-4088-a252-38027799ccc7",
      "39b2c1c9-df3d-408f-bf31-a9f6e18c9692",
      "07105436-4f4d-4209-bae0-9b7487eb5a40",
      "766bfa4f-935b-4b15-8855-d9f8464b871e"
    ]
  },
  "quality": {
    "overall_score": 0.0,
    "confidence": 0.0,
    "component_scores": {},
    "completeness": 0.0,
    "coordinate_integrity": 0.0,
    "geometry_validity": 0.0,
    "plane_fit_quality": 0.0,
    "segment_consistency": 0.0,
    "warnings_count": 0,
    "blockers_count": 0
  },
  "validation": {
    "validation_status": "passed",
    "validated_at": "2026-06-04T00:00:00Z",
    "validator_version": "0.0.0-not-hardened",
    "errors": [],
    "warnings": [],
    "blockers": [],
    "export_allowed": true,
    "report_allowed": true
  },
  "lineage": {
    "input_artifact_ids": [
      "c8bdd16c-6502-425a-be7a-62028dd35e6d",
      "39b2c1c9-df3d-408f-bf31-a9f6e18c9692",
      "07105436-4f4d-4209-bae0-9b7487eb5a40",
      "766bfa4f-935b-4b15-8855-d9f8464b871e"
    ],
    "source_files": [],
    "source_job_id": "00000000-0000-4000-8000-000000000001",
    "parameters": {},
    "skill_version": "0.1.0",
    "code_version": "git:abc1234",
    "runtime": {
      "language": "typescript",
      "version": "deno-1.44"
    },
    "created_by": "control_plane",
    "dependencies": []
  },
  "warnings": [],
  "errors": [],
  "storage": {
    "storage_type": "supabase_storage",
    "uri": "supabase://measurement-artifacts/00000000-0000-4000-8000-000000000001/exports/measurement_report.pdf",
    "bucket": "measurement-artifacts",
    "path": "00000000-0000-4000-8000-000000000001/exports/measurement_report.pdf",
    "mime_type": "application/pdf",
    "checksum": {
      "algo": "sha256",
      "value": "deadbeefdeadbeefdeadbeefdeadbeefdeadbeefdeadbeefdeadbeefdeadbeef"
    },
    "byte_size": 1284123,
    "compression": "none",
    "encoding": "binary"
  },
  "display": {
    "display_units": {
      "area": "sqft",
      "pitch": "x_per_12",
      "length": "ft"
    },
    "rounding_rules": {
      "area_sqft": 0,
      "pitch": 1,
      "length_ft": 1
    },
    "labels": {},
    "report_visibility": "customer",
    "map_visibility": "hidden"
  }
}