{
  "schema_version": "1.0.0",
  "envelope_version": 1,
  "artifact_id": "766bfa4f-935b-4b15-8855-d9f8464b871e",
  "job_id": "00000000-0000-4000-8000-000000000001",
  "parent_artifact_ids": [
    "d3007ffc-4cf0-4088-a252-38027799ccc7",
    "39b2c1c9-df3d-408f-bf31-a9f6e18c9692",
    "07105436-4f4d-4209-bae0-9b7487eb5a40"
  ],
  "artifact_type": "geometry_quality_score",
  "stage": "geometry_quality_score",
  "source_skill": "geometry_quality_score",
  "producer": {
    "kind": "worker",
    "name": "geometry_quality_score",
    "version": "0.1.0"
  },
  "status": "complete",
  "created_at": "2026-06-04T00:00:00Z",
  "coordinate_frame": {
    "frame_id": "project_metric_utm17n",
    "frame_type": "project_metric",
    "crs": "EPSG:32617",
    "origin": null,
    "axis_orientation": "ENU",
    "units": "m",
    "has_z": true,
    "z_convention": "orthometric_m",
    "transform_to_source": null,
    "transform_to_local": null,
    "transform_to_raster": null,
    "transform_to_export": null,
    "precision": {
      "xy_m": 0.05,
      "z_m": 0.1
    },
    "status": "complete"
  },
  "units": {
    "horizontal_distance": "m",
    "vertical_distance": "m",
    "area": "m^2",
    "slope": "deg",
    "pitch": "rise_per_12",
    "angle": "deg",
    "raster_resolution": "m_per_px",
    "confidence": "ratio_0_1",
    "quality_score": "ratio_0_1"
  },
  "geometry": {
    "geometry_type": "none",
    "coordinate_frame": "project_metric_utm17n",
    "dimensions": null,
    "bbox": null,
    "value": null,
    "storage_ref": null,
    "precision": null,
    "no_data_policy": null
  },
  "data": {
    "overall_score": 0.83,
    "pass": true,
    "components": {
      "source_freshness": 0.95,
      "point_density": 0.89,
      "dsm_quality": 0.92,
      "roof_point_density": 0.88,
      "plane_rmse": 0.86,
      "facet_coverage": 0.81,
      "perimeter_confidence": 0.79,
      "obstruction_penalty": 0.95,
      "pitch_plausibility": 0.85,
      "area_reconciliation": 0.78
    },
    "weights": {
      "source_freshness": 0.05,
      "point_density": 0.1,
      "dsm_quality": 0.1,
      "roof_point_density": 0.15,
      "plane_rmse": 0.15,
      "facet_coverage": 0.1,
      "perimeter_confidence": 0.15,
      "obstruction_penalty": 0.05,
      "pitch_plausibility": 0.1,
      "area_reconciliation": 0.05
    },
    "needs_review_reason": null
  },
  "quality": {
    "overall_score": 0.83,
    "confidence": 0.0,
    "component_scores": {},
    "completeness": 0.0,
    "coordinate_integrity": 0.0,
    "geometry_validity": 0.0,
    "plane_fit_quality": 0.0,
    "segment_consistency": 0.0,
    "warnings_count": 0,
    "blockers_count": 0
  },
  "validation": {
    "validation_status": "pending",
    "validated_at": null,
    "validator_version": null,
    "errors": [],
    "warnings": [],
    "blockers": [],
    "export_allowed": false,
    "report_allowed": false
  },
  "lineage": {
    "input_artifact_ids": [
      "d3007ffc-4cf0-4088-a252-38027799ccc7",
      "39b2c1c9-df3d-408f-bf31-a9f6e18c9692",
      "07105436-4f4d-4209-bae0-9b7487eb5a40"
    ],
    "source_files": [],
    "source_job_id": "00000000-0000-4000-8000-000000000001",
    "parameters": {},
    "skill_version": "0.1.0",
    "code_version": "git:abc1234",
    "runtime": {
      "language": "python",
      "version": "3.11"
    },
    "created_by": "worker",
    "dependencies": []
  },
  "warnings": [],
  "errors": []
}