{
  "schema_version": "1.0.0",
  "envelope_version": 1,
  "artifact_id": "7ee157e9-abec-451f-9f7c-3b762f1bdefd",
  "job_id": "00000000-0000-4000-8000-000000000001",
  "parent_artifact_ids": [
    "6601fe06-fcec-4953-9ed5-0d62e1af79ef",
    "e22ae73b-a634-4ed0-aeb1-756f7d0bb931"
  ],
  "artifact_type": "chm",
  "stage": "generate_chm",
  "source_skill": "generate_chm",
  "producer": {
    "kind": "worker",
    "name": "generate_chm",
    "version": "0.1.0"
  },
  "status": "complete",
  "created_at": "2026-06-04T00:00:00Z",
  "coordinate_frame": {
    "frame_id": "raster_grid_dsm",
    "frame_type": "raster_grid",
    "crs": "EPSG:32617",
    "origin": null,
    "axis_orientation": "ENU",
    "units": "m",
    "has_z": true,
    "z_convention": "orthometric_m",
    "transform_to_source": null,
    "transform_to_local": null,
    "transform_to_raster": null,
    "transform_to_export": null,
    "precision": {
      "xy_m": 0.05,
      "z_m": 0.1
    },
    "status": "complete"
  },
  "units": {
    "horizontal_distance": "m",
    "vertical_distance": "m",
    "area": "m^2",
    "slope": "deg",
    "pitch": "rise_per_12",
    "angle": "deg",
    "raster_resolution": "m_per_px",
    "confidence": "ratio_0_1",
    "quality_score": "ratio_0_1"
  },
  "geometry": {
    "geometry_type": "raster",
    "coordinate_frame": "raster_grid_dsm",
    "dimensions": {
      "width_px": 2048,
      "height_px": 2048
    },
    "bbox": [
      635100.0,
      3324500.0,
      635202.4,
      3324602.4
    ],
    "value": null,
    "storage_ref": null,
    "precision": {
      "xy_m": 0.05
    },
    "no_data_policy": {
      "sentinel": -9999,
      "mask_band": null
    }
  },
  "data": {
    "raster_uri": "supabase://measurement-artifacts/00000000-0000-4000-8000-000000000001/chm/chm.tif",
    "height_above_ground_stats": {
      "mean_m": 5.42,
      "p50_m": 5.31,
      "p95_m": 8.1,
      "max_m": 9.04,
      "above_2m_percent": 41.7
    },
    "invalid_pixel_percent": 3.2
  },
  "quality": {
    "overall_score": 0.0,
    "confidence": 0.0,
    "component_scores": {},
    "completeness": 0.0,
    "coordinate_integrity": 0.0,
    "geometry_validity": 0.0,
    "plane_fit_quality": 0.0,
    "segment_consistency": 0.0,
    "warnings_count": 0,
    "blockers_count": 0
  },
  "validation": {
    "validation_status": "pending",
    "validated_at": null,
    "validator_version": null,
    "errors": [],
    "warnings": [],
    "blockers": [],
    "export_allowed": false,
    "report_allowed": false
  },
  "lineage": {
    "input_artifact_ids": [
      "6601fe06-fcec-4953-9ed5-0d62e1af79ef",
      "e22ae73b-a634-4ed0-aeb1-756f7d0bb931"
    ],
    "source_files": [],
    "source_job_id": "00000000-0000-4000-8000-000000000001",
    "parameters": {},
    "skill_version": "0.1.0",
    "code_version": "git:abc1234",
    "runtime": {
      "language": "python",
      "version": "3.11"
    },
    "created_by": "worker",
    "dependencies": []
  },
  "warnings": [],
  "errors": [],
  "storage": {
    "storage_type": "supabase_storage",
    "uri": "supabase://measurement-artifacts/00000000-0000-4000-8000-000000000001/chm/chm.tif",
    "bucket": "measurement-artifacts",
    "path": "00000000-0000-4000-8000-000000000001/chm/chm.tif",
    "mime_type": "image/tiff",
    "checksum": {
      "algo": "sha256",
      "value": "deadbeefdeadbeefdeadbeefdeadbeefdeadbeefdeadbeefdeadbeefdeadbeef"
    },
    "byte_size": 4194304,
    "compression": "none",
    "encoding": "binary"
  }
}