{
  "schema_version": "1.0.0",
  "envelope_version": 1,
  "artifact_id": "d3007ffc-4cf0-4088-a252-38027799ccc7",
  "job_id": "00000000-0000-4000-8000-000000000001",
  "parent_artifact_ids": [
    "90712270-ca26-459f-ae36-4e6b2989f8f5",
    "2ab6f71d-e129-405e-a33d-9ab9627ad826"
  ],
  "artifact_type": "roof_planes",
  "stage": "fit_roof_planes",
  "source_skill": "fit_roof_planes",
  "producer": {
    "kind": "worker",
    "name": "fit_roof_planes",
    "version": "0.1.0"
  },
  "status": "complete",
  "created_at": "2026-06-04T00:00:00Z",
  "coordinate_frame": {
    "frame_id": "project_metric_utm17n",
    "frame_type": "project_metric",
    "crs": "EPSG:32617",
    "origin": null,
    "axis_orientation": "ENU",
    "units": "m",
    "has_z": true,
    "z_convention": "orthometric_m",
    "transform_to_source": null,
    "transform_to_local": null,
    "transform_to_raster": null,
    "transform_to_export": null,
    "precision": {
      "xy_m": 0.05,
      "z_m": 0.1
    },
    "status": "complete"
  },
  "units": {
    "horizontal_distance": "m",
    "vertical_distance": "m",
    "area": "m^2",
    "slope": "deg",
    "pitch": "rise_per_12",
    "angle": "deg",
    "raster_resolution": "m_per_px",
    "confidence": "ratio_0_1",
    "quality_score": "ratio_0_1"
  },
  "geometry": {
    "geometry_type": "plane_set",
    "coordinate_frame": "project_metric_utm17n",
    "dimensions": null,
    "bbox": [
      635112.0,
      3324518.0,
      635148.0,
      3324554.0
    ],
    "value": null,
    "storage_ref": null,
    "precision": {
      "xy_m": 0.05,
      "z_m": 0.06
    },
    "no_data_policy": null
  },
  "data": {
    "planes": [
      {
        "plane_id": "p1",
        "normal": [
          0.0,
          -0.45,
          0.89,
          -102.5
        ],
        "boundary": [
          [
            635112,
            3324518
          ],
          [
            635130,
            3324518
          ],
          [
            635130,
            3324536
          ],
          [
            635112,
            3324536
          ],
          [
            635112,
            3324518
          ]
        ],
        "rmse_m": 0.06,
        "inlier_count": 48211,
        "slope_deg": 26.6
      },
      {
        "plane_id": "p2",
        "normal": [
          0.0,
          0.45,
          0.89,
          -102.5
        ],
        "boundary": [
          [
            635130,
            3324536
          ],
          [
            635148,
            3324536
          ],
          [
            635148,
            3324554
          ],
          [
            635130,
            3324554
          ],
          [
            635130,
            3324536
          ]
        ],
        "rmse_m": 0.07,
        "inlier_count": 46902,
        "slope_deg": 26.6
      }
    ]
  },
  "quality": {
    "overall_score": 0.88,
    "confidence": 0.0,
    "component_scores": {},
    "completeness": 0.0,
    "coordinate_integrity": 0.0,
    "geometry_validity": 0.0,
    "plane_fit_quality": 0.93,
    "segment_consistency": 0.0,
    "warnings_count": 0,
    "blockers_count": 0
  },
  "validation": {
    "validation_status": "pending",
    "validated_at": null,
    "validator_version": null,
    "errors": [],
    "warnings": [],
    "blockers": [],
    "export_allowed": false,
    "report_allowed": false
  },
  "lineage": {
    "input_artifact_ids": [
      "90712270-ca26-459f-ae36-4e6b2989f8f5",
      "2ab6f71d-e129-405e-a33d-9ab9627ad826"
    ],
    "source_files": [],
    "source_job_id": "00000000-0000-4000-8000-000000000001",
    "parameters": {},
    "skill_version": "0.1.0",
    "code_version": "git:abc1234",
    "runtime": {
      "language": "python",
      "version": "3.11"
    },
    "created_by": "worker",
    "dependencies": []
  },
  "warnings": [],
  "errors": []
}