{
  "schema_version": "1.0.0",
  "envelope_version": 1,
  "artifact_id": "07105436-4f4d-4209-bae0-9b7487eb5a40",
  "job_id": "00000000-0000-4000-8000-000000000001",
  "parent_artifact_ids": [
    "d3007ffc-4cf0-4088-a252-38027799ccc7"
  ],
  "artifact_type": "roof_area_measurements",
  "stage": "calculate_roof_area",
  "source_skill": "calculate_roof_area",
  "producer": {
    "kind": "worker",
    "name": "calculate_roof_area",
    "version": "0.1.0"
  },
  "status": "complete",
  "created_at": "2026-06-04T00:00:00Z",
  "coordinate_frame": {
    "frame_id": "project_metric_utm17n",
    "frame_type": "project_metric",
    "crs": "EPSG:32617",
    "origin": null,
    "axis_orientation": "ENU",
    "units": "m",
    "has_z": true,
    "z_convention": "orthometric_m",
    "transform_to_source": null,
    "transform_to_local": null,
    "transform_to_raster": null,
    "transform_to_export": null,
    "precision": {
      "xy_m": 0.05,
      "z_m": 0.1
    },
    "status": "complete"
  },
  "units": {
    "horizontal_distance": "m",
    "vertical_distance": "m",
    "area": "m^2",
    "slope": "deg",
    "pitch": "rise_per_12",
    "angle": "deg",
    "raster_resolution": "m_per_px",
    "confidence": "ratio_0_1",
    "quality_score": "ratio_0_1"
  },
  "geometry": {
    "geometry_type": "none",
    "coordinate_frame": "project_metric_utm17n",
    "dimensions": null,
    "bbox": null,
    "value": null,
    "storage_ref": null,
    "precision": null,
    "no_data_policy": null
  },
  "data": {
    "total_roof_area_m2": 144.8,
    "total_roof_area_sqft": 1558.66,
    "total_flat_footprint_m2": 129.6,
    "roofing_squares": 15.59,
    "per_facet": [
      {
        "plane_id": "p1",
        "flat_area_m2": 64.8,
        "slope_adjusted_area_m2": 72.4,
        "slope_deg": 26.57,
        "slope_factor": 1.118
      },
      {
        "plane_id": "p2",
        "flat_area_m2": 64.8,
        "slope_adjusted_area_m2": 72.4,
        "slope_deg": 26.57,
        "slope_factor": 1.118
      }
    ]
  },
  "quality": {
    "overall_score": 0.0,
    "confidence": 0.0,
    "component_scores": {},
    "completeness": 0.0,
    "coordinate_integrity": 0.0,
    "geometry_validity": 0.0,
    "plane_fit_quality": 0.0,
    "segment_consistency": 0.0,
    "warnings_count": 0,
    "blockers_count": 0
  },
  "validation": {
    "validation_status": "pending",
    "validated_at": null,
    "validator_version": null,
    "errors": [],
    "warnings": [],
    "blockers": [],
    "export_allowed": false,
    "report_allowed": false
  },
  "lineage": {
    "input_artifact_ids": [
      "d3007ffc-4cf0-4088-a252-38027799ccc7"
    ],
    "source_files": [],
    "source_job_id": "00000000-0000-4000-8000-000000000001",
    "parameters": {},
    "skill_version": "0.1.0",
    "code_version": "git:abc1234",
    "runtime": {
      "language": "python",
      "version": "3.11"
    },
    "created_by": "worker",
    "dependencies": []
  },
  "warnings": [],
  "errors": [],
  "display": {
    "display_units": {
      "area": "sqft",
      "pitch": "x_per_12",
      "length": "ft"
    },
    "rounding_rules": {
      "area_sqft": 0,
      "pitch": 1,
      "length_ft": 1
    },
    "labels": {},
    "report_visibility": "customer",
    "map_visibility": "always"
  }
}